post_title,post_text,upvotes,downvotes,post_title_neutral,post_title_positive,post_title_negative,post_text_neutral,post_text_positive,post_text_negative
US farmers win right to repair John Deere equipment,,43925.0,0.0,0.424057275056839,0.5743297934532166,0.0016129264840856194,,,
Ford Lightning owner powers home essentials for 2 days and still had battery left in the tank,,27258.0,0.0,0.7207223176956177,0.013896486721932888,0.2653811275959015,,,
"Sorry, Apple — a portless iPhone is a terrible idea",,24558.0,0.0,0.010303499177098274,0.005121173802763224,0.9845752716064453,,,
Artificial pancreas successfully treats type 1 diabetes,,22194.0,0.0,0.24298350512981415,0.7549511790275574,0.00206537963822484,,,
"Scalpers struggling to sell RTX 4080 cards, now ‘graciously’ offering them at MSRP",,20790.0,0.0,0.9020331501960754,0.09093816578388214,0.0070285857655107975,,,
