post_title,post_text,upvotes,downvotes,post_title_neutral,post_title_positive,post_title_negative,post_text_neutral,post_text_positive,post_text_negative
If Instagram Was Around in the 1990's,I found this on Daily Dose Of Internet,51940.0,0.0,0.9316904544830322,0.05419130623340607,0.01411827839910984,0.9705408811569214,0.02676602639257908,0.0026930493768304586
The glacier rivers of Alaska,,48696.0,0.0,0.9789876937866211,0.014782842248678207,0.00622949842363596,,,
Miss Ukraine National Costume on Miss Universe,,48626.0,0.0,0.901745080947876,0.09670267254114151,0.0015522085595875978,,,
Rain replenshing the small pools of a wash in Arizona,,38876.0,0.0,0.8644670844078064,0.13383018970489502,0.0017027269350364804,,,
I designed and animated an old saw mill out of Lego! It could become a real set!,,31935.0,0.0,0.2360757291316986,0.7628618478775024,0.0010624564019963145,,,
