post_title,post_text,upvotes,downvotes,post_title_neutral,post_title_positive,post_title_negative,post_text_neutral,post_text_positive,post_text_negative
The American public no longer believes the Supreme Court is impartial,,81692.0,0.0,0.25846290588378906,0.005657183472067118,0.7358798384666443,,,
"Trump Must Pay Hillary Clinton $171,631 in Legal Fees Over Bogus Lawsuit",,68390.0,0.0,0.713115930557251,0.007299399469047785,0.279584676027298,,,
"Republican candidate's wife arrested, charged with casting 23 fraudulent votes for her husband in the 2020 election",,68359.0,0.0,0.06373308598995209,0.003028412349522114,0.9332384467124939,,,
Democrats introduce constitutional amendment to reverse Citizens United campaign finance ruling,,66222.0,0.0,0.9037262201309204,0.01609533466398716,0.08017849177122116,,,
Gov. Greg Abbott said Texas 'desperately needs more money' to address the border after spending millions on busing migrants to other parts of the country,,65300.0,0.0,0.6072807312011719,0.009830712340772152,0.382888525724411,,,
